qid,question,relevant_cids,num_relevant,question_norm
62503,Hồ sơ nhập học lớp 10 gồm có những giấy tờ gì?,[66970],1,hồ sơ nhập học lớp 10 gồm có những giấy tờ gì?
114880,Ký kết thỏa thuận quốc tế là gì?,[66169],1,ký kết thỏa thuận quốc tế là gì?
69961,Luật Hợp tác xã 2023 khi nào có hiệu lực?,[96250],1,luật hợp tác xã 2023 khi nào có hiệu lực?
160113,Tiêu chuẩn bổ nhiệm thừa phát lại là gì?,[8932],1,tiêu chuẩn bổ nhiệm thừa phát lại là gì?
130211,Thành lập Quỹ hỗ trợ việc làm ngoài nước,[172894],1,thành lập quỹ hỗ trợ việc làm ngoài nước
54917,Công nhân công an được hưởng bao nhiêu loại phụ cấp?,[28465],1,công nhân công an được hưởng bao nhiêu loại phụ cấp?
20562,Thuế giá trị gia tăng là gì?,[72282],1,thuế giá trị gia tăng là gì?
35082,Thông tư 24/2023/TT-BCA về biển số xe cơ giới được chính thức áp dụng từ ngày nào?,[143],1,thông tư 24/2023/tt-bca về biển số xe cơ giới được chính thức áp dụng từ ngày nào?
143993,Giấy ủy quyền là gì?,"[222704, 222705]",2,giấy ủy quyền là gì?
88253,Điều kiện để giáo viên trung học phổ thông kiêm nhiệm quản lý phòng thiết bị được áp dụng chế độ phụ cấp gồm những điều kiện nào?,"[63969, 160354]",2,điều kiện để giáo viên trung học phổ thông kiêm nhiệm quản lý phòng thiết bị được áp dụng chế độ phụ cấp gồm những điều kiện nào?
2363,Nhiệm vụ của Trung tâm Hành động bom mìn quốc gia Việt Nam là gì?,[3158],1,nhiệm vụ của trung tâm hành động bom mìn quốc gia việt nam là gì?
34382,Hóa đơn liên đỏ (Liên giao cho Khách hàng) có dùng làm bản chính để chứng thực được không?,[32175],1,hóa đơn liên đỏ (liên giao cho khách hàng) có dùng làm bản chính để chứng thực được không?
113051,Văn phòng công chứng sẽ có những nghĩa vụ gì?,[107314],1,văn phòng công chứng sẽ có những nghĩa vụ gì?
9866,Điều kiện để một tổ chức tôn giáo được công nhận là gì?,[2146],1,điều kiện để một tổ chức tôn giáo được công nhận là gì?
12538,Giấy phép hoạt động xây dựng là gì?,[75458],1,giấy phép hoạt động xây dựng là gì?
58706,Mức hưởng bảo hiểm xã hội một lần được tính như thế nào?,[69690],1,mức hưởng bảo hiểm xã hội một lần được tính như thế nào?
141837,Trung tâm phát triển quỹ đất là gì?,[24959],1,trung tâm phát triển quỹ đất là gì?
148647,Thân nhân của liệt sĩ được hưởng trợ cấp tuất hằng tháng gồm có những người nào?,[97053],1,thân nhân của liệt sĩ được hưởng trợ cấp tuất hằng tháng gồm có những người nào?
8382,Bảo hiểm y tế là gì?,[62015],1,bảo hiểm y tế là gì?
71886,Thuế giá trị gia tăng là gì?,[72282],1,thuế giá trị gia tăng là gì?
123102,Nhiệm vụ của Quỹ Nước sạch và Bảo vệ môi trường Việt Nam là gì?,[142057],1,nhiệm vụ của quỹ nước sạch và bảo vệ môi trường việt nam là gì?
7634,Giáo trình đào tạo của trường trung cấp nghề phải đảm bảo những yêu cầu nào?,[3345],1,giáo trình đào tạo của trường trung cấp nghề phải đảm bảo những yêu cầu nào?
96322,Chế độ mặc và tư trang của phạm nhân được quy định như thế nào?,[17766],1,chế độ mặc và tư trang của phạm nhân được quy định như thế nào?
128186,Hồ sơ điểm đen tai nạn giao thông đường bộ bao gồm những giấy tờ gì?,[34161],1,hồ sơ điểm đen tai nạn giao thông đường bộ bao gồm những giấy tờ gì?
28825,Trách nhiệm của cơ quan bảo hiểm xã hội được quy định như thế nào?,[81791],1,trách nhiệm của cơ quan bảo hiểm xã hội được quy định như thế nào?
157241,Giám sát của Mặt trận Tổ quốc Việt Nam theo hình thức nào?,[88916],1,giám sát của mặt trận tổ quốc việt nam theo hình thức nào?
138676,Cấp bậc quân hàm Thiếu tá quân nhân chuyên nghiệp có hệ số lương bao nhiêu?,[216746],1,cấp bậc quân hàm thiếu tá quân nhân chuyên nghiệp có hệ số lương bao nhiêu?
92605,Hòa giải tranh chấp đất đai có bắt buộc các bên tranh chấp phải có mặt hay không?,[118101],1,hòa giải tranh chấp đất đai có bắt buộc các bên tranh chấp phải có mặt hay không?
165015,"Hồ sơ, thủ tục xóa đăng ký thường trú được quy định như thế nào?",[51350],1,"hồ sơ, thủ tục xóa đăng ký thường trú được quy định như thế nào?"
159957,Giấy chứng nhận cơ sở đủ điều kiện an toàn thực phẩm có thời hạn trong bao lâu?,[70306],1,giấy chứng nhận cơ sở đủ điều kiện an toàn thực phẩm có thời hạn trong bao lâu?
131275,Hồ sơ đăng ký xe lần đầu gồm những gì?,[23068],1,hồ sơ đăng ký xe lần đầu gồm những gì?
129634,Nhiệm vụ của Hiệp hội Kính xây dựng Việt Nam là gì?,[96123],1,nhiệm vụ của hiệp hội kính xây dựng việt nam là gì?
5492,Thi hành án hình sự là gì?,[42951],1,thi hành án hình sự là gì?
112138,"Doanh nghiệp chế xuất nước ngoài có được tạm nhập khẩu, tái xuất hàng hóa vào Việt Nam hay không?","[5264, 151092, 151093]",3,"doanh nghiệp chế xuất nước ngoài có được tạm nhập khẩu, tái xuất hàng hóa vào việt nam hay không?"
60030,Mức chuẩn trợ giúp xã hội hiện nay là bao nhiêu?,[29895],1,mức chuẩn trợ giúp xã hội hiện nay là bao nhiêu?
79314,Luật Hợp tác xã 2023 có hiệu lực từ khi nào?,[96250],1,luật hợp tác xã 2023 có hiệu lực từ khi nào?
133263,Tổ chức hoạt động kỷ niệm ngày truyền thống đối với cơ quan nhà nước cấp bộ phải đảm bảo những nguyên tắc nào?,[13643],1,tổ chức hoạt động kỷ niệm ngày truyền thống đối với cơ quan nhà nước cấp bộ phải đảm bảo những nguyên tắc nào?
118267,Tiêu chuẩn bổ nhiệm thừa phát lại là gì?,[193912],1,tiêu chuẩn bổ nhiệm thừa phát lại là gì?
175060,Công chức là ai?,[31053],1,công chức là ai?
109127,Đối tượng nào không được đăng ký nghĩa vụ quân sự?,[61905],1,đối tượng nào không được đăng ký nghĩa vụ quân sự?
100073,Tổ chức tôn giáo là gì?,[72483],1,tổ chức tôn giáo là gì?
119925,Thông tư 33/2023/TT-BTC chính thức có hiệu lực từ khi nào?,[77166],1,thông tư 33/2023/tt-btc chính thức có hiệu lực từ khi nào?
114288,Thời hạn giải quyết chế độ dưỡng sức sau khi sinh là bao lâu?,[75091],1,thời hạn giải quyết chế độ dưỡng sức sau khi sinh là bao lâu?
143860,Xử phạt vi phạm hành chính đối với hành vi xâm phạm trái phép chỗ ở người khác,"[62074, 62075]",2,xử phạt vi phạm hành chính đối với hành vi xâm phạm trái phép chỗ ở người khác
5021,Diện tích sử dụng chung của đơn vị sự nghiệp công lập được quy định như thế nào?,"[67061, 21678]",2,diện tích sử dụng chung của đơn vị sự nghiệp công lập được quy định như thế nào?
46585,Chứng chỉ hành nghề xây dựng là gì?,[111627],1,chứng chỉ hành nghề xây dựng là gì?
161448,Cơ cấu tổ chức của Chi cục Đường thủy nội địa khu vực được quy định như thế nào?,[148063],1,cơ cấu tổ chức của chi cục đường thủy nội địa khu vực được quy định như thế nào?
116038,Điều kiện kết hôn được quy định như thế nào?,"[47569, 47566]",2,điều kiện kết hôn được quy định như thế nào?
95383,Phù hiệu của công chức thanh tra chuyên ngành thống kê được pháp luật quy định như thế nào?,[117861],1,phù hiệu của công chức thanh tra chuyên ngành thống kê được pháp luật quy định như thế nào?
37972,Tập đoàn Công nghiệp Cao su Việt Nam có tư cách pháp nhân và có được có tài khoản ngoại tệ tại Kho bạc Nhà nước không?,[104009],1,tập đoàn công nghiệp cao su việt nam có tư cách pháp nhân và có được có tài khoản ngoại tệ tại kho bạc nhà nước không?
39425,Nếu thực hiện nhiều hành vi vi phạm thì xử phạt vi phạm hành chính như thế nào?,[63070],1,nếu thực hiện nhiều hành vi vi phạm thì xử phạt vi phạm hành chính như thế nào?
11784,Ký kết thỏa thuận quốc tế là gì?,[66169],1,ký kết thỏa thuận quốc tế là gì?
104464,Quỹ bình ổn giá xăng dầu được thực hiện như thế nào?,[65891],1,quỹ bình ổn giá xăng dầu được thực hiện như thế nào?
11803,Mua ngoại tệ để chuyển hoặc mang ra nước ngoài được quy định ra sao?,[74635],1,mua ngoại tệ để chuyển hoặc mang ra nước ngoài được quy định ra sao?
142814,Căn cứ vào đâu để xét chọn doanh nghiệp được trao tặng Giải thưởng Doanh nghiệp tiêu biểu vì người lao động?,[204230],1,căn cứ vào đâu để xét chọn doanh nghiệp được trao tặng giải thưởng doanh nghiệp tiêu biểu vì người lao động?
705,Điều kiện để người lao động nước ngoài làm việc tại Việt Nam là gì?,[62212],1,điều kiện để người lao động nước ngoài làm việc tại việt nam là gì?
1872,Bao lâu sẽ được cấp tài khoản định danh điện tử đối với công dân Việt Nam?,[63515],1,bao lâu sẽ được cấp tài khoản định danh điện tử đối với công dân việt nam?
134421,Khi nào được hưởng lương hưu?,[102693],1,khi nào được hưởng lương hưu?
53334,Hình thức tuyển dụng công chức cấp xã thông qua thi tuyển áp dụng với chức danh nào?,[68388],1,hình thức tuyển dụng công chức cấp xã thông qua thi tuyển áp dụng với chức danh nào?
58384,Quấy rối tình dục tại nơi làm việc bao gồm những hành vi nào?,[126858],1,quấy rối tình dục tại nơi làm việc bao gồm những hành vi nào?
149197,"Các hành vi nào bị cấm trong lĩnh vực hóa đơn, chứng từ?",[85837],1,"các hành vi nào bị cấm trong lĩnh vực hóa đơn, chứng từ?"
158841,Chứng từ kế toán là gì?,[62889],1,chứng từ kế toán là gì?
32318,Thông tư 04/2023/TT-BTP được áp dụng từ ngày mấy?,[91617],1,thông tư 04/2023/tt-btp được áp dụng từ ngày mấy?
106819,Ban thanh tra nhân dân ở đơn vị sự nghiệp công lập có vai trò gì?,[22638],1,ban thanh tra nhân dân ở đơn vị sự nghiệp công lập có vai trò gì?
41351,Hồ sơ hiện vật dự kiến mua lập hồ sơ trình Hội đồng khoa học bao gồm những gì?,[15057],1,hồ sơ hiện vật dự kiến mua lập hồ sơ trình hội đồng khoa học bao gồm những gì?
13119,Nhiệm vụ của Hiệp hội Các nhà đầu tư Việt Nam sang Lào là gì?,[76106],1,nhiệm vụ của hiệp hội các nhà đầu tư việt nam sang lào là gì?
38110,Nghị định 70/2023/NĐ-CP khi nào được áp dụng?,[72824],1,nghị định 70/2023/nđ-cp khi nào được áp dụng?
25167,Hồ sơ đăng ký hoạt động bán hàng đa cấp tại địa phương bao gồm những giấy tờ gì?,[42393],1,hồ sơ đăng ký hoạt động bán hàng đa cấp tại địa phương bao gồm những giấy tờ gì?
39536,Sửa đổi quy định về hồ sơ đề nghị cấp lại giấy chứng nhận đủ điều kiện kinh doanh khai thác cảng biển?,[105757],1,sửa đổi quy định về hồ sơ đề nghị cấp lại giấy chứng nhận đủ điều kiện kinh doanh khai thác cảng biển?
114347,Hồ sơ nhập học lớp 10 năm học 2023-2024 tại Hà Nội gồm những gì?,[123651],1,hồ sơ nhập học lớp 10 năm học 2023-2024 tại hà nội gồm những gì?
123730,Có khi nào giá xăng bị trạm xăng bán cao hơn giá thị trường hay không?,[72768],1,có khi nào giá xăng bị trạm xăng bán cao hơn giá thị trường hay không?
16905,"Trong việc quản lý nhà nước về xuất khẩu, nhập khẩu thì Cục Xuất nhập khẩu có những nhiệm vụ nào?",[80386],1,"trong việc quản lý nhà nước về xuất khẩu, nhập khẩu thì cục xuất nhập khẩu có những nhiệm vụ nào?"
138252,Công chức là ai?,[31053],1,công chức là ai?
137993,Nghị định 33/2023/NĐ-CP khi nào chính thức có hiệu lực?,[78739],1,nghị định 33/2023/nđ-cp khi nào chính thức có hiệu lực?
173950,Giấy phép xây dựng là gì?,"[83581, 81467]",2,giấy phép xây dựng là gì?
83618,Hóa đơn điện tử là gì?,[40896],1,hóa đơn điện tử là gì?
31668,"Đăng ký hành nghề đối với cơ sở khám bệnh, chữa bệnh bao gồm các nội dung nào?",[12361],1,"đăng ký hành nghề đối với cơ sở khám bệnh, chữa bệnh bao gồm các nội dung nào?"
176705,Thử việc trong thời gian bao lâu?,[61953],1,thử việc trong thời gian bao lâu?
27054,Nhiệm vụ của Hội Kiều học Việt Nam là gì?,[90996],1,nhiệm vụ của hội kiều học việt nam là gì?
94124,Quyền hạn của Hiệp hội Thiết bị giáo dục Việt Nam là gì?,[131862],1,quyền hạn của hiệp hội thiết bị giáo dục việt nam là gì?
67674,Phó Bí thư Đảng ủy cấp xã là cán bộ hay công chức?,[31110],1,phó bí thư đảng ủy cấp xã là cán bộ hay công chức?
140775,Phòng giao dịch bưu điện trực thuộc LPBank chấm dứt hoạt động trong các trường hợp nào?,[43803],1,phòng giao dịch bưu điện trực thuộc lpbank chấm dứt hoạt động trong các trường hợp nào?
94020,Bảo hiểm y tế là gì?,[62015],1,bảo hiểm y tế là gì?
148648,Mức hỗ trợ nhà ở cho thân nhân liệt sĩ mới nhất như thế nào?,[111124],1,mức hỗ trợ nhà ở cho thân nhân liệt sĩ mới nhất như thế nào?
98537,Chứng chỉ môi giới bất động sản bị thu hồi khi nào?,[124668],1,chứng chỉ môi giới bất động sản bị thu hồi khi nào?
25867,"Người vi phạm giao thông nhận thông tin xử phạt thông qua Cổng dịch vụ công Quốc gia, Cổng dịch vụ công Bộ Công an có đúng không?",[90425],1,"người vi phạm giao thông nhận thông tin xử phạt thông qua cổng dịch vụ công quốc gia, cổng dịch vụ công bộ công an có đúng không?"
45175,"Hạn chót đăng ký nguyện vọng xét tuyển đại học, cao đẳng 2023 là ngày nào?",[73078],1,"hạn chót đăng ký nguyện vọng xét tuyển đại học, cao đẳng 2023 là ngày nào?"
161929,Vụ Hợp tác quốc tế thuộc Bộ Thông tin và Truyền thông có chức năng gì?,[61479],1,vụ hợp tác quốc tế thuộc bộ thông tin và truyền thông có chức năng gì?
26804,Quy trình chuẩn hóa dữ liệu khí tượng thủy văn được thực hiện như thế nào?,"[91486, 91487]",2,quy trình chuẩn hóa dữ liệu khí tượng thủy văn được thực hiện như thế nào?
136504,"Trình tự, thủ tục cấp chứng chỉ thẩm tra viên an toàn giao thông đường bộ được pháp luật quy định như thế nào?",[75127],1,"trình tự, thủ tục cấp chứng chỉ thẩm tra viên an toàn giao thông đường bộ được pháp luật quy định như thế nào?"
90156,Nhiệm vụ của Trung tâm Giám định bảo hiểm y tế và Thanh toán đa tuyến là gì?,[83808],1,nhiệm vụ của trung tâm giám định bảo hiểm y tế và thanh toán đa tuyến là gì?
16748,Điểm ưu tiên để tính điểm thi đại học năm 2023 quy đổi ra sao?,"[66485, 66487]",2,điểm ưu tiên để tính điểm thi đại học năm 2023 quy đổi ra sao?
75508,Nghị quyết của Hội đồng quản lý trong tổ chức khoa học và công nghệ công lập được thông qua khi nào?,[146100],1,nghị quyết của hội đồng quản lý trong tổ chức khoa học và công nghệ công lập được thông qua khi nào?
51934,Quyết định giải thể doanh nghiệp phải bao gồm các nội dung chủ yếu nào?,[63872],1,quyết định giải thể doanh nghiệp phải bao gồm các nội dung chủ yếu nào?
94444,Việc quyết định giá dịch vụ sự nghiệp công được thực hiện khi nào?,[84648],1,việc quyết định giá dịch vụ sự nghiệp công được thực hiện khi nào?
15482,Pháp nhân thương mại là gì?,[58201],1,pháp nhân thương mại là gì?
24241,Các hành vi nào thì bị nghiêm cấm khi tham gia bảo hiểm y tế?,[70561],1,các hành vi nào thì bị nghiêm cấm khi tham gia bảo hiểm y tế?
127927,Chủ đầu tư dự án xây dựng nhà ở thương mại có những quyền gì?,[78026],1,chủ đầu tư dự án xây dựng nhà ở thương mại có những quyền gì?
76032,"Trình tự, thủ tục nộp hồ sơ cấp Giấy chứng nhận đủ điều kiện về an ninh trật tự ra sao?",[60528],1,"trình tự, thủ tục nộp hồ sơ cấp giấy chứng nhận đủ điều kiện về an ninh trật tự ra sao?"
165562,Kế hoạch giám sát dịch bệnh động vật thủy sản bao gồm những nội dung gì?,[223297],1,kế hoạch giám sát dịch bệnh động vật thủy sản bao gồm những nội dung gì?
118770,Trình tự thủ tục cấp thẻ căn cước công dân như thế nào?,[88030],1,trình tự thủ tục cấp thẻ căn cước công dân như thế nào?
57202,Ký kết thỏa thuận quốc tế là gì?,[66169],1,ký kết thỏa thuận quốc tế là gì?
109430,Thông tư 24/2023/TT-BCA về biển số xe cơ giới được chính thức áp dụng từ ngày nào?,[63328],1,thông tư 24/2023/tt-bca về biển số xe cơ giới được chính thức áp dụng từ ngày nào?
145185,Thủ tục nhập học Đại học năm 2023 được thực hiện thế nào?,[63971],1,thủ tục nhập học đại học năm 2023 được thực hiện thế nào?
67676,Nghị định 33/2023/NĐ-CP khi nào chính thức có hiệu lực?,[143],1,nghị định 33/2023/nđ-cp khi nào chính thức có hiệu lực?
141290,Ai có thẩm quyền quyết định khóa tài khoản định danh điện tử?,[66685],1,ai có thẩm quyền quyết định khóa tài khoản định danh điện tử?
98308,Nghị định 33/2023/NĐ-CP khi nào chính thức có hiệu lực?,[78739],1,nghị định 33/2023/nđ-cp khi nào chính thức có hiệu lực?
7099,"Việc thu thập, quản lý, khai thác và sử dụng thông tin, dữ liệu tài nguyên và môi trường phải tuân theo các nguyên tắc nào?",[54091],1,"việc thu thập, quản lý, khai thác và sử dụng thông tin, dữ liệu tài nguyên và môi trường phải tuân theo các nguyên tắc nào?"
4147,Nhà ở liên kế được xây dựng theo quy hoạch chung tại đâu và cần đảm bảo các nguyên tắc gì về thiết kế xây dựng?,[66067],1,nhà ở liên kế được xây dựng theo quy hoạch chung tại đâu và cần đảm bảo các nguyên tắc gì về thiết kế xây dựng?
60609,Quỹ bình ổn giá xăng dầu được thực hiện như thế nào?,[65891],1,quỹ bình ổn giá xăng dầu được thực hiện như thế nào?
152536,Công chức là ai?,[31053],1,công chức là ai?
11785,Ký kết thỏa thuận quốc tế dựa trên những nguyên tắc nào?,[66170],1,ký kết thỏa thuận quốc tế dựa trên những nguyên tắc nào?
144877,Các khoản lệ phí mà Hội đồng nhân dân có thẩm quyền quy định?,[56716],1,các khoản lệ phí mà hội đồng nhân dân có thẩm quyền quy định?
115595,Hội đồng đạo đức trong nghiên cứu y sinh học cấp cơ sở có nhiệm vụ gì?,[190928],1,hội đồng đạo đức trong nghiên cứu y sinh học cấp cơ sở có nhiệm vụ gì?
87187,"Các trường hợp nào được xác định là đúng tuyến khám bệnh, chữa bệnh bảo hiểm y tế?",[72772],1,"các trường hợp nào được xác định là đúng tuyến khám bệnh, chữa bệnh bảo hiểm y tế?"
72610,Hiệp định RCEP là hiệp định gì?,[133741],1,hiệp định rcep là hiệp định gì?
127790,Hiệu lực của Giấy chứng nhận doanh nghiệp nông nghiệp ứng dụng công nghệ cao là bao lâu?,[28486],1,hiệu lực của giấy chứng nhận doanh nghiệp nông nghiệp ứng dụng công nghệ cao là bao lâu?
108080,Có mấy phương thức tuyển sinh đại học?,[61655],1,có mấy phương thức tuyển sinh đại học?
80204,Các trường hợp ly hôn theo quy định pháp luật,[47617],1,các trường hợp ly hôn theo quy định pháp luật
78034,Thương nhân kinh doanh dịch vụ xăng dầu có quyền và nghĩa vụ thế nào?,[65892],1,thương nhân kinh doanh dịch vụ xăng dầu có quyền và nghĩa vụ thế nào?
73335,Lập hóa đơn điện tử không có mã của cơ quan thuế như thế nào?,[14874],1,lập hóa đơn điện tử không có mã của cơ quan thuế như thế nào?
40109,Thủ tục yêu cầu cấp Phiếu lý lịch tư pháp được quy định như thế nào?,"[69992, 106396]",2,thủ tục yêu cầu cấp phiếu lý lịch tư pháp được quy định như thế nào?
18982,Ngoại tệ là gì? Nguyên tắc tính trạng thái ngoại tệ được quy định như thế nào?,[7107],1,ngoại tệ là gì? nguyên tắc tính trạng thái ngoại tệ được quy định như thế nào?
86782,Nguyên tắc xếp lương công chức chuyên ngành Ngân hàng như thế nào?,[69657],1,nguyên tắc xếp lương công chức chuyên ngành ngân hàng như thế nào?
5471,Tuổi của học sinh các cấp là bao nhiêu?,[44053],1,tuổi của học sinh các cấp là bao nhiêu?
179259,Thẩm quyền cấp giấy phép xây dựng,[73915],1,thẩm quyền cấp giấy phép xây dựng
59185,Xác định tiền lương đóng quỹ phòng chống thiên tai ra sao?,[91240],1,xác định tiền lương đóng quỹ phòng chống thiên tai ra sao?
52184,Trách nhiệm của thành viên Hội đồng lựa chọn dự án sản xuất phim có sử dụng ngân sách nhà nước là gì?,[66030],1,trách nhiệm của thành viên hội đồng lựa chọn dự án sản xuất phim có sử dụng ngân sách nhà nước là gì?
91424,Kiểm tra viên chính hải quan thực hiện những nhiệm vụ gì?,[128438],1,kiểm tra viên chính hải quan thực hiện những nhiệm vụ gì?
107157,Quyền và nghĩa vụ người trúng đấu giá biển số xe ô tô theo Nghị quyết 73/2022/QH15 ra sao?,[90192],1,quyền và nghĩa vụ người trúng đấu giá biển số xe ô tô theo nghị quyết 73/2022/qh15 ra sao?
5453,"Trình tự, thủ tục đánh giá, xếp loại chất lượng công chức như thế nào?",[58017],1,"trình tự, thủ tục đánh giá, xếp loại chất lượng công chức như thế nào?"
114949,Thông tư 32/2023/TT-BCA được áp dụng từ khi nào?,[143],1,thông tư 32/2023/tt-bca được áp dụng từ khi nào?
50948,Khi nào áp dụng Nghị định 71/2023/NĐ-CP?,[80982],1,khi nào áp dụng nghị định 71/2023/nđ-cp?
152041,Thuế giá trị gia tăng là gì?,[72282],1,thuế giá trị gia tăng là gì?
124582,Nghị định 31/2023/NĐ-CP có hiệu lực từ ngày nào?,[66111],1,nghị định 31/2023/nđ-cp có hiệu lực từ ngày nào?
157345,Nhiệm vụ của Hội Giải phẫu bệnh Tế bào bệnh học Việt Nam là gì?,[113563],1,nhiệm vụ của hội giải phẫu bệnh tế bào bệnh học việt nam là gì?
70945,Tổ chức tôn giáo là gì?,[72483],1,tổ chức tôn giáo là gì?
66575,Nhà đầu tư có dự án đầu tư đã được chấp thuận chủ trương đầu tư phải thực hiện thủ tục chấp thuận điều chỉnh chủ trương đầu tư khi nào?,[64741],1,nhà đầu tư có dự án đầu tư đã được chấp thuận chủ trương đầu tư phải thực hiện thủ tục chấp thuận điều chỉnh chủ trương đầu tư khi nào?
159255,"Thủ tục khám bệnh, chữa bệnh bảo hiểm y tế ra sao?",[67354],1,"thủ tục khám bệnh, chữa bệnh bảo hiểm y tế ra sao?"
41875,Nguyên tắc khen thưởng được quy định như thế nào?,[7682],1,nguyên tắc khen thưởng được quy định như thế nào?
51456,Tổng thời gian làm việc và các dịp được nghỉ của giáo viên tiểu học được quy định như thế nào?,[63022],1,tổng thời gian làm việc và các dịp được nghỉ của giáo viên tiểu học được quy định như thế nào?
